{
  "$schema": "https://json-schema.org/draft/2020-12/schema",
  "$id": "urn:areneon:schema:contracts:v1:progress-evaluation-record",
  "title": "ProgressEvaluationRecord",
  "type": "object",
  "additionalProperties": false,
  "required": [
    "schema_version",
    "data_class",
    "run_id",
    "run_config_hash",
    "generation",
    "generation_manifest_sha256",
    "checkpoints",
    "version_manifest",
    "teams",
    "plan",
    "matches",
    "games"
  ],
  "properties": {
    "schema_version": {
      "const": 1
    },
    "data_class": {
      "description": "Always synthetic: a progress evaluation runs on public, synthetic, CC0 data only.",
      "const": "synthetic"
    },
    "run_id": {
      "type": "string",
      "pattern": "^[A-Za-z0-9][A-Za-z0-9._:-]{0,127}$",
      "description": "The run key (TrainingRunConfig.seeds.run_key)."
    },
    "run_config_hash": {
      "description": "SHA-256 of the run's TrainingRunConfig JCS bytes.",
      "type": "string",
      "pattern": "^[0-9a-f]{64}$"
    },
    "generation": {
      "description": "The generation whose frozen pair was evaluated (0 is the seeded initial pair).",
      "type": "integer",
      "minimum": 0,
      "maximum": 9007199254740991
    },
    "generation_manifest_sha256": {
      "description": "SHA-256 of generations/g<N>/manifest.json: binds the record to one committed generation.",
      "type": "string",
      "pattern": "^[0-9a-f]{64}$"
    },
    "checkpoints": {
      "$ref": "#/$defs/Checkpoints"
    },
    "version_manifest": {
      "$ref": "#/$defs/VersionManifest"
    },
    "teams": {
      "$ref": "#/$defs/Teams"
    },
    "plan": {
      "$ref": "#/$defs/Plan"
    },
    "matches": {
      "description": "Sorted by match_id, each once.",
      "type": "array",
      "items": {
        "$ref": "#/$defs/Match"
      }
    },
    "games": {
      "description": "One row per game of every match, in match then game order.",
      "type": "array",
      "items": {
        "$ref": "#/$defs/GameRow"
      }
    }
  },
  "description": "The progress evaluation of one generation's frozen pair (ADR-017 section 2): fixed-plan matches against scripted baselines on the validation split of the run's team dataset. A progress view only: never the sealed Training gate, never a selection input, no strength claim. Integers only; the Wilson interval is derived on display and is conditional on the fixed validation plan. Reader rules the profile cannot say: counts add up and agree with the game rows, matches are sorted and unique, game rows are complete and in order, hashes sorted and unique, and the stored games number plan.recorded_games_per_match per match.",
  "$defs": {
    "VersionManifest": {
      "description": "Replay identity of a battle (ADR-003, ADR-007): the pinned engine commit, the format, and the hashes of the engine ruleset and of Areneon's own format rules.",
      "type": "object",
      "additionalProperties": false,
      "required": [
        "showdown_commit",
        "format_id",
        "regulation",
        "ruleset_hash",
        "format_rules_hash"
      ],
      "properties": {
        "showdown_commit": {
          "description": "The pinned engine commit.",
          "type": "string",
          "pattern": "^[0-9a-f]{40}$"
        },
        "format_id": {
          "type": "string",
          "pattern": "^[a-z0-9]+$"
        },
        "regulation": {
          "type": "string",
          "minLength": 1
        },
        "ruleset_hash": {
          "description": "SHA-256 of the canonical engine ruleset.",
          "type": "string",
          "pattern": "^[0-9a-f]{64}$"
        },
        "format_rules_hash": {
          "description": "SHA-256 of Areneon's format rules record (ADR-007).",
          "type": "string",
          "pattern": "^[0-9a-f]{64}$"
        }
      }
    },
    "Checkpoints": {
      "description": "A frozen pair, by the ids of its two checkpoints.",
      "type": "object",
      "additionalProperties": false,
      "required": [
        "preview",
        "battle"
      ],
      "properties": {
        "preview": {
          "description": "Checkpoint id (SHA-256 of the file) of the Team Preview network.",
          "type": "string",
          "pattern": "^[0-9a-f]{64}$"
        },
        "battle": {
          "description": "Checkpoint id of the battle network.",
          "type": "string",
          "pattern": "^[0-9a-f]{64}$"
        }
      }
    },
    "Teams": {
      "description": "The teams every match was played on.",
      "type": "object",
      "additionalProperties": false,
      "required": [
        "dataset_hash",
        "split",
        "pairs_used"
      ],
      "properties": {
        "dataset_hash": {
          "description": "The team dataset's hash, as the run config names it.",
          "type": "string",
          "pattern": "^[0-9a-f]{64}$"
        },
        "split": {
          "const": "validation"
        },
        "pairs_used": {
          "description": "Disjoint ordered validation team pairs each match used: one per game.",
          "type": "integer",
          "minimum": 1,
          "maximum": 9007199254740991
        }
      }
    },
    "Plan": {
      "description": "What every match played: derivations, sizes and caps.",
      "type": "object",
      "additionalProperties": false,
      "required": [
        "seed_derivation",
        "pairing",
        "games_per_match",
        "recorded_games_per_match",
        "max_turns",
        "latency_budget_ms"
      ],
      "properties": {
        "seed_derivation": {
          "const": "progress-seed/1"
        },
        "pairing": {
          "const": "progress-pairing/1"
        },
        "games_per_match": {
          "description": "Games in every match; game k uses pair k.",
          "type": "integer",
          "minimum": 1,
          "maximum": 9007199254740991
        },
        "recorded_games_per_match": {
          "description": "The first this-many games of every match are stored as ProgressGameRecords.",
          "type": "integer",
          "minimum": 0,
          "maximum": 9007199254740991
        },
        "max_turns": {
          "description": "The turn cap of the run's TrainingRunConfig.generation: a game still running past it is a tie.",
          "type": "integer",
          "minimum": 1,
          "maximum": 9007199254740991
        },
        "latency_budget_ms": {
          "$ref": "#/$defs/LatencyBudget"
        }
      }
    },
    "LatencyBudget": {
      "description": "The per-decision latency budgets of the run's config.",
      "type": "object",
      "additionalProperties": false,
      "required": [
        "preview_ms",
        "battle_ms"
      ],
      "properties": {
        "preview_ms": {
          "type": "integer",
          "minimum": 1,
          "maximum": 9007199254740991
        },
        "battle_ms": {
          "type": "integer",
          "minimum": 1,
          "maximum": 9007199254740991
        }
      }
    },
    "Opponent": {
      "description": "Who the frozen pair played: a scripted baseline, or the previous generation's frozen pair.",
      "type": "object",
      "oneOf": [
        {
          "$ref": "#/$defs/BaselineOpponent"
        },
        {
          "$ref": "#/$defs/PreviousOpponent"
        }
      ],
      "discriminator": {
        "propertyName": "kind"
      }
    },
    "BaselineOpponent": {
      "type": "object",
      "additionalProperties": false,
      "required": [
        "kind",
        "policy_id"
      ],
      "properties": {
        "kind": {
          "const": "baseline"
        },
        "policy_id": {
          "description": "The baseline's policy id, <name>@<version>.",
          "type": "string",
          "pattern": "^[a-z0-9][a-z0-9._-]*@[A-Za-z0-9._-]+$"
        }
      }
    },
    "PreviousOpponent": {
      "type": "object",
      "additionalProperties": false,
      "required": [
        "kind",
        "policy_id",
        "checkpoints"
      ],
      "properties": {
        "kind": {
          "const": "previous"
        },
        "policy_id": {
          "type": "string",
          "pattern": "^policy:[0-9a-f]{64}$",
          "description": "The previous generation's pair, in the mode the match played."
        },
        "checkpoints": {
          "$ref": "#/$defs/Checkpoints"
        }
      }
    },
    "ForfeitCount": {
      "type": "object",
      "additionalProperties": false,
      "required": [
        "side",
        "cause",
        "count"
      ],
      "properties": {
        "side": {
          "description": "The side whose policy failed.",
          "enum": [
            "candidate",
            "opponent"
          ]
        },
        "cause": {
          "description": "Why the policy failed, as the harness classifies a forfeit (crash, out_of_memory, invalid_reply, latency_overrun).",
          "type": "string",
          "pattern": "^[a-z][a-z_]{0,31}$"
        },
        "count": {
          "type": "integer",
          "minimum": 1,
          "maximum": 9007199254740991
        }
      }
    },
    "Match": {
      "type": "object",
      "additionalProperties": false,
      "required": [
        "match_id",
        "policy_id",
        "opponent",
        "mode",
        "games",
        "wins",
        "ties",
        "losses",
        "turn_cap_ties",
        "turns_total",
        "forfeits",
        "game_record_hashes"
      ],
      "properties": {
        "match_id": {
          "description": "Names the match: <opponent>-<mode>, e.g. random-legal-sample. Unique in the record; names the stored game files.",
          "type": "string",
          "pattern": "^[a-z0-9][a-z0-9_-]{0,63}$"
        },
        "policy_id": {
          "type": "string",
          "pattern": "^policy:[0-9a-f]{64}$",
          "description": "The candidate's policy id in this match's mode: policy: plus SHA-256 of the JCS of {preview, battle, mode, temperature, precision}."
        },
        "opponent": {
          "$ref": "#/$defs/Opponent"
        },
        "mode": {
          "description": "The candidate's choice rule: sample at temperature 1, or argmax.",
          "enum": [
            "sample",
            "argmax"
          ]
        },
        "games": {
          "type": "integer",
          "minimum": 1,
          "maximum": 9007199254740991
        },
        "wins": {
          "description": "Candidate wins, forfeits by the opponent included.",
          "type": "integer",
          "minimum": 0,
          "maximum": 9007199254740991
        },
        "ties": {
          "type": "integer",
          "minimum": 0,
          "maximum": 9007199254740991
        },
        "losses": {
          "description": "Candidate losses, forfeits by the candidate included.",
          "type": "integer",
          "minimum": 0,
          "maximum": 9007199254740991
        },
        "turn_cap_ties": {
          "description": "Games among the ties that ended because the turn cap was reached.",
          "type": "integer",
          "minimum": 0,
          "maximum": 9007199254740991
        },
        "turns_total": {
          "description": "Sum of the turns of the match's games.",
          "type": "integer",
          "minimum": 0,
          "maximum": 9007199254740991
        },
        "forfeits": {
          "description": "Forfeits by side and cause, sorted by side then cause, each pair once.",
          "type": "array",
          "items": {
            "$ref": "#/$defs/ForfeitCount"
          }
        },
        "game_record_hashes": {
          "description": "SHA-256 of the JCS bytes of each stored ProgressGameRecord of the match, sorted and unique; its length is plan.recorded_games_per_match.",
          "type": "array",
          "items": {
            "type": "string",
            "pattern": "^[0-9a-f]{64}$"
          }
        }
      }
    },
    "Played": {
      "type": "object",
      "additionalProperties": false,
      "required": [
        "kind",
        "winner",
        "turns"
      ],
      "properties": {
        "kind": {
          "const": "played"
        },
        "winner": {
          "enum": [
            "candidate",
            "opponent",
            "tie"
          ]
        },
        "turns": {
          "type": "integer",
          "minimum": 0,
          "maximum": 9007199254740991
        }
      }
    },
    "Forfeit": {
      "type": "object",
      "additionalProperties": false,
      "required": [
        "kind",
        "loser",
        "cause",
        "request_seq",
        "turns"
      ],
      "properties": {
        "kind": {
          "const": "forfeit"
        },
        "loser": {
          "enum": [
            "candidate",
            "opponent"
          ]
        },
        "cause": {
          "description": "Why the policy failed, as the harness classifies a forfeit (crash, out_of_memory, invalid_reply, latency_overrun).",
          "type": "string",
          "pattern": "^[a-z][a-z_]{0,31}$"
        },
        "request_seq": {
          "description": "The failing side's own request number.",
          "type": "integer",
          "minimum": 1,
          "maximum": 9007199254740991
        },
        "turns": {
          "type": "integer",
          "minimum": 0,
          "maximum": 9007199254740991
        }
      }
    },
    "Outcome": {
      "description": "How one game ended, seen from the candidate: played to an end, or forfeited by a policy.",
      "type": "object",
      "oneOf": [
        {
          "$ref": "#/$defs/Played"
        },
        {
          "$ref": "#/$defs/Forfeit"
        }
      ],
      "discriminator": {
        "propertyName": "kind"
      }
    },
    "GameRow": {
      "description": "One game's result: the per-game results table of protocol section 8.1.",
      "type": "object",
      "additionalProperties": false,
      "required": [
        "match_id",
        "game",
        "pair",
        "candidate_seat",
        "outcome"
      ],
      "properties": {
        "match_id": {
          "type": "string",
          "pattern": "^[a-z0-9][a-z0-9_-]{0,63}$"
        },
        "game": {
          "description": "Game index within the match; its seed is progress-seed/1's for this index.",
          "type": "integer",
          "minimum": 0,
          "maximum": 9007199254740991
        },
        "pair": {
          "description": "The validation team pair the game used (equal to the game index).",
          "type": "integer",
          "minimum": 0,
          "maximum": 9007199254740991
        },
        "candidate_seat": {
          "description": "p1 for an even game, p2 for an odd one.",
          "enum": [
            "p1",
            "p2"
          ]
        },
        "outcome": {
          "$ref": "#/$defs/Outcome"
        }
      }
    }
  }
}
